text,category,justification
254: a person performing acrobatics surrounded by street audience,Spatial,Indicates the location and surrounding audience of the acrobat.
255: a boxer wearing boxing gloves who is defending,Action,Describes the action of a boxer defending themselves.
256: an attacking boxer wearing boxing gloves,Action,Indicates the boxer's active engagement in a fight.
257: the referee presiding over the boxing match,Spatial,Indicates the referee’s position within the boxing match.
258: a running dog pulling a sled,Action,Describes the dog’s movement and its function of pulling the sled.
259: a sled pulled by a dog,Spatial,Shows the spatial relationship between the sled and the dog.
260: a person on dogsleds,Action,Represents the person’s activity of traveling on a dogsled.
261: an adult athlete with naked upper body in places with pools,Attribute,Describes the athlete’s physical state (naked upper body) and location.
262: water polo player with ball,Spatial,Shows the player and the ball's position in relation to each other.
263: the swimming cap on the head of a water polo player,Spatial,Indicates the location of the swimming cap on the player’s head.
264: barbell lifted above the head,Action,Describes the athlete’s movement of lifting the barbell.
265: barbell on the chest,Spatial,Represents the barbell’s position relative to the weightlifter’s body.
266: a weightlifter with barbell below the lower body,Spatial,Indicates the barbell’s position relative to the weightlifter’s body.
267: the wooden sword in the hand of a kendo player,Spatial,Shows the location of the sword in relation to the kendo player.
268: a fencing athlete wearing a helmet,Attribute,Describes the athlete’s protective equipment (helmet) and physical state.
269: a kendo player in battle with another person,Action,Indicates a dynamic scene of combat between two people.
270: referee of taekwondo match,Spatial,Indicates the referee’s position within the taekwondo match.
271: a taekwondo athlete wearing helmets,Action,Indicates the athlete is performing a taekwondo move while wearing protective headgear.
272: a taekwondo athlete who is kicking,Action,Focuses on the movement being performed by the athlete.
273: a kite for kite surfing,Attribute,Describes a specific object associated with the activity of kite surfing.
274: a person who is surfing kites,Action,Highlights the activity of riding kites in the water.
275: surfboard in kite surfing,Object,Identifies the primary equipment used in kite surfing.
276: partially damaged car,Condition,"Describes the state of the vehicle, emphasizing its damage."
277: a motorcycle lying on the ground,Condition,"Indicates that the motorcycle is in a damaged state, specifically overturned."
278: overturned car,Condition,Specifies the orientation and damage of the car.
279: person covered with armor,Attribute,Describes the protective gear being worn by the individual.
280: the headdress of coser wearing skirt,Attribute,Focuses on a specific piece of attire worn by the individual.
281: a bicycle worn by a helmet rider,Object,Identifies the bicycle and the protective equipment attached to it.
282: a cyclist wearing a helmet on a bicycle,Attribute,Describes both the person and the protective equipment they are using.
283: the goggles on the face of a cyclist wearing a helmet,Attribute,Describes the protective eyewear worn in conjunction with the helmet.
284: the helmet on the head of the person on the slide,Spatial,Indicates the location of the helmet relative to the person.
285: rope track of slide rope,Object,Describes the structural element of the slide.
286: a pair of gloves on a persons hands on the slide,Spatial,Indicates the gloves' location on the person’s hands during a slide.
287: a person who is doing yoga in sleeveless vests,Action,Describes the activity (yoga) and a specific garment worn by the person.
288: woman stretching,Action,Specifies the action being performed by the woman.
289: a person who sits with his feet folded on a yoga mat,Spatial,Details the person’s posture and the surface they are sitting on.
290: a person squatting on the walking rope,Action,Describes the action of squatting performed on the rope.
291: a person who stands upright on the walking rope,Spatial,Indicates the person’s position and location on the walking rope.
292: a person standing on a rope with one foot,Spatial,Describes the person's stance and location on the rope.
293: a person in opentop racing cars,Spatial,Indicates the location of the person within the racing cars.
294: motorcycle racing car running at a tilt,Action,Represents the movement and angle of the racing car.
295: an opentop racing car,Spatial,Describes the location and type of racing car.
296: blue stop sign with white letter p,Attribute,Specifies the color and a key characteristic of the stop sign.
297: single parking space marked,Spatial,Indicates the location of the parking space and its marking.
298: car in parking space,Spatial,Specifies the location of the car within the parking space.
299: diabolo on the rope,Spatial,Indicates the location of the diabolo on the rope.
300: diabolo flying in the air,Action,Represents the movement of the diabolo.
301: a person playing diabolo,Action,Indicates the activity of playing the diabolo.
302: dart stuck on the target,Spatial,Indicates the location of the dart relative to the target.
303: a person with darts,Spatial,Indicates the person is holding the darts.
304: target with darts,Spatial,Indicates the location of the darts relative to the target.
305: a person who kneels down to propose to the opposite sex,Action,Indicates the action of proposing.
306: the person who was proposed to on one knee,Spatial,Indicates the person’s position relative to the proposer.
307: the thing held by the person who proposed on one knee,Spatial,Describes the object held by the person during the proposal.
308: hot air balloon with words on it,Attribute,Highlights a key characteristic of the hot air balloon (having words).
309: hot air balloon landing on the ground,Spatial,Indicates the location of the balloon relative to the ground.
310: fired hot air balloon,Action,Indicates the action of the hot air balloon being launched.
311: a sailboat,Attribute,Describes a key characteristic of the sailboat.
312: a ship on the shore,Spatial,Indicates the location of the ship relative to the shore.
313: a boat with someone rowing on the water,Action,Indicates the activity of rowing the boat.
314: origami that looks like a bird,Attribute,Describes a key characteristic of the origami (resembling a bird).
315: origami that looks like an animal,Attribute,Describes a key characteristic of the origami (resembling an animal).
316: origami that looks like flowers,Form,Indicates the three-dimensional shape and resemblance to flowers.
317: horseman without helmet,Attribute,Highlights the absence of a key element (helmet) associated with the horseman.
318: dog not led by ropes outside,Attribute,Focuses on the lack of a traditional leash and restraint for the dog.
319: basketball untouched,Attribute,Emphasizes the state of the basketball—its lack of being used.
320: dish without any spoons,Attribute,Points out the absence of a standard utensil on the dish.
321: bartender without suit,Attribute,Highlights the absence of a formal garment associated with the bartender’s profession.
322: pot without food,Attribute,Focuses on the lack of contents within the pot.
323: a sofa with no pillow on it in the room,Attribute,Indicates the missing accessory on the sofa.
324: cat not looking directly at the camera in the room,Attribute,"Specifies the cat’s averted gaze, a deviation from typical portraiture."
325: a bed without patterns on it,Attribute,Highlights the absence of a decorative or patterned element on the bed.
326: a blackboard or whiteboard without any words in the classroom,Attribute,Focuses on the blank state of the writing surface.
327: a bookshelf without people around,Attribute,Indicates the absence of human presence near the bookshelf.
328: a cake without cream on the surface,Attribute,Emphasizes the lack of a standard topping on the cake.
329: doughnut with no colored particles on the surface,Attribute,Specifies the absence of decorative elements on the doughnut's surface.
330: vegetablefree hot dog,Attribute,Indicates the absence of a typical ingredient (vegetables) in the hot dog.
331: a flowerpot without flowers,State,Indicates the absence of flowers in the flowerpot.
332: incomplete apple,State,Indicates the apple is not fully formed or consumed.
333: toothbrush not in peoples hands,State,Indicates the toothbrush is not being used or held by anyone.
334: a chair where no one is sitting in the barber shop,State,Indicates the chair is unoccupied within the context of the barber shop.
335: a toy other than human toys,Attribute,Specifies that the toy is not designed for or associated with humans.
336: empty shopping cart in the supermarket,State,"Indicates the cart is devoid of items, signifying its empty condition."
337: nonhuman mask,Attribute,Highlights that the mask is not intended for or worn by a human.
338: an unopened refrigerator,State,Signifies the refrigerator’s unutilized and closed state.
339: a watch not on human wrists,State,Indicates the watch is not worn or held by a human.
340: hanger without clothes,State,Highlights the lack of clothing on the hanger.
341: nonshoulder bag without human body,State,Indicates the bag is not being carried by or associated with a human.
342: a fisher who stands on the shore and whose lower body is not submerged by water,State,"Describes the specific state of the fisher, emphasizing the water’s absence around his legs."
343: a camera that no one holds,State,"Highlights the camera’s inactive state, emphasizing its absence of a user."
344: an unopened oven,State,Signifies the oven’s unutilized and closed state.
345: a doctor or nurse wearing nongreen clothes,Attribute,Specifies the color of the doctor or nurse's clothing.
346: a dancing woman with no knees exposed,Action,"Indicates the woman is performing a dance, focusing on the movement."
347: unused microphone stand on stage,Spatial,Describes the microphone stand’s location and state of disuse on the stage.
348: a person who stands on the stage for speech but dont open their mouths,Spatial,Focuses on the person's position and lack of verbal activity on the stage.
349: aircraft not on the ground,Spatial,Describes the aircraft’s location – not grounded.
350: a cable car without people inside,Spatial,Describes the cable car’s location and lack of occupants.
351: a person who didnt land or touch anything on the stage,Spatial,Focuses on the person’s position and lack of interaction with the stage.
352: a person who hugs another person but doesnt touch his face,Action,"Indicates the action of hugging, while specifying a restriction on physical contact."
353: a woman in white wedding dress not beside any men in suits,Spatial,Describes the woman’s appearance and her positioning relative to other people on stage.
354: a person in santa claus clothes without bags,Attribute,"Indicates the person is wearing Santa Claus attire, specifying a key characteristic."
355: a person with a pen in one hand but not looking at paper,Action,"Describes the person’s action of holding a pen, while indicating a lack of visual engagement."
356: a billiard ball with no numbers or patterns on its surface on the table,Attribute,Highlights the billiard ball’s specific characteristics – its blank surface.
357: an unoccupied chessboard,Spatial,Describes the chessboard's location and state of being empty.
358: a person at the conference table who is not seated,Spatial,"Focuses on the person’s position – standing at the table, without being seated."
359: a person in cheerleading clothes who is not held in the air,Action,"Indicates the person is wearing cheerleading attire and performing the action of cheerleading, while restricting the action."
360: a baseball player without a cap on his head,Attribute,"Describes the baseball player’s attire, specifically the absence of a cap."
361: a person wearing football helmets but not running,Spatial,Indicates the position of the helmets relative to the person.
362: athlete wearing nonwhite stockings on the green field,Attribute,Describes the color and location of the stockings.
363: a person with a tennis racket and no feet left the ground,Action,Illustrates the action of holding a racket without moving.
364: a person standing at the table of table tennis who is not waving table tennis rackets,Spatial,Shows the person’s position relative to the table tennis equipment.
365: indoor volleyball not touched by hands,Action,Depicts the ball’s movement in volleyball without human contact.
366: a person who is not standing upright on the ski resort,Spatial,Indicates the person's posture and location on the ski resort.
367: surfboard not on the beach,Spatial,Shows the surfboard’s location away from its typical environment.
368: a gymnast who is not touching anything in the air,Action,Illustrates the gymnast’s movement in the air without contact.
369: an empty swing bench,Spatial,Indicates the position of the swing bench.
370: an empty swimming pool,Spatial,Shows the location of the empty pool.
371: a male lion who is not lying,Spatial,Indicates the lion’s posture and location.
372: parrot not on human body,Spatial,Describes the parrot’s location relative to the human body.
373: camel not lying on the ground,Spatial,Indicates the camel’s posture and location.
374: redcrowned crane not standing on the ground,Spatial,Indicates the crane's posture and location.
375: giant panda without all four feet on the ground,Spatial,Indicates the panda’s posture and location.
376: an autosalon girl without bare waist,Attribute,Indicates the lack of a specific body feature (bare waist) of the girl.
377: a lion dance that is not upright,Action,Describes the incorrect posture or movement of the lion during the dance.
378: a rock climber without helmet,Attribute,Indicates the absence of a protective item (helmet) worn by the climber.
379: nonburning torch,Attribute,Describes the state of the torch – it is not producing flame.
380: a butterfly that doesnt stop on flowers,Action,Indicates the butterfly is not performing the typical action of landing on flowers.
381: aircraft flying in the air without smoke trail,Attribute,Describes the absence of a characteristic feature (smoke trail) of the aircraft.
382: frisbee not held by anyone,Attribute,Indicates the frisbee is not being held or possessed by anyone.
383: golf ball not in the air,Attribute,Indicates the golf ball is not airborne.
384: helicopter not flying in the air,Attribute,Describes the helicopter’s state – it is not airborne.
385: well cover without words on the surface,Attribute,Indicates the absence of words on the surface of the cover.
386: mailbox not marked with numbers,Attribute,Indicates the lack of numerical markings on the mailbox.
387: a deer without antlers,Attribute,Indicates the absence of a characteristic feature (antlers) of the deer.
388: kangaroo not standing,Action,Describes the kangaroo’s incorrect posture – it is not standing.
389: woodpecker not on the side of the trunk,Action,Indicates the woodpecker is not performing the typical action of perching on a tree trunk.
390: an eagle without wings,Attribute,Indicates the absence of a characteristic feature (wings) of the eagle.
391: a dolphin whose head is not above the water,Spatial,Indicates the dolphin's position relative to the water surface.
392: a seal not in the water,Spatial,Indicates the seal’s location relative to the water.
393: a peacock who is not opening the screen,Action,Indicates the peacock is not performing the action of opening a screen.
394: swan not in the water,Spatial,Indicates the swan’s location relative to the water.
395: hippo whose mouth are not open,Spatial,Indicates the hippo’s position relative to its open mouth.
396: the moon that does not appear completely round,Attribute,Describes a specific quality or characteristic of the moon.
397: a person whose eyes are invisible in sunglasses,Attribute,Focuses on a specific feature (eyes) obscured by a specific attribute (sunglasses).
398: otter not in the water,Spatial,Indicates the otter’s location relative to the water.
399: volleyball in the middle of the air untouched on the beach,Spatial,Describes the volleyball’s position and state (unmoved) in space.
400: a street food truck without an umbrella,Attribute,Indicates the absence of a specific item (umbrella) and its effect.
401: a street performer without audience,Attribute,Indicates the absence of a specific element (audience) and its consequence.
402: a person not wearing boxing gloves on the stage,Attribute,Focuses on a specific item (boxing gloves) and its absence.
403: a sled dog that is not running,Action,Indicates the dog is not performing the action of running.
404: a water polo player who is in the water but does not hold the ball,Spatial,Describes the player’s location and the state of the ball relative to them.
405: a barbell held by a weightlifter that has not been lifted above the head,Action,Indicates the weightlifter is holding the barbell but not performing the action of lifting it.
406: a kendo athlete without helmet,State,"Indicates the absence of a helmet, defining a key characteristic of the athlete's situation."
407: a taekwondo athlete who is not kicking with their feets,State,"Indicates the absence of a kicking action, highlighting a deviation from typical taekwondo performance."
408: kite surfer who didnt touch the water,State,"Indicates the absence of interaction with the water, a crucial element for a kite surfer."
409: a door that is not damaged on a damaged car,State,Highlights the undamaged state of the door relative to the damaged car.
410: a girl with black hair and anime clothes,Attribute,Describes the girl’s physical appearance and clothing style.
411: a helmeted cyclist without companions in the race,State,"Shows the cyclist wearing a helmet, alongside the lack of any racing companions."
412: a person who wears a helmet and sling equipment but is not on the sling,State,Describes the presence of equipment and absence of use of the equipment.
413: a person on the yoga mat who is not meditating,State,Indicates a physical presence on the mat coupled with the absence of meditation.
414: a person who doesnt touch the rope with both feet,State,Shows the absence of a specific action with the rope.
415: nonconvertible racing car,Attribute,Describes the car’s specific feature: inability to convert.
416: stop sign with white letters on a blue background,Attribute,Details the appearance of the stop sign - its color and lettering.
417: a diabolo not being played with rope,State,"Highlights the absence of the rope, which is essential for playing the diabolo."
418: a dart that doesnt stick to the target,State,Indicates the failure of the dart to reach its intended target.
419: person who kneels on one knee and proposes but has nothing in his hand,State,Describes a specific pose and action without any accompanying items.
420: hot air balloon without ignition,State,"Highlights the absence of the ignition, a necessary component for the balloon’s operation."
421: a boat that needs manual rowing but no one,Object,Describes a physical object – a boat – and its state.
422: origami unlike birds,Object,"Refers to a specific art form (origami) and compares it to another object (birds), indicating a visual representation."
